{
  "schemaVersion": 1,
  "id": "hr-zagreb-2026-10-08-purchases",
  "destinationId": "hr-zagreb",
  "capturedAt": "2026-10-08T06:27:08.177Z",
  "exchangeRates": {
    "reportCurrency": "EUR",
    "rates": {
      "EUR": "1"
    }
  },
  "offerPrices": [
    {
      "offerId": "aliexpress-as5600-angle-sensor",
      "availability": "unknown",
      "observedAt": null,
      "taxTreatment": "unknown",
      "price": null
    },
    {
      "offerId": "aliexpress-bearing-608-2rs",
      "availability": "unknown",
      "observedAt": null,
      "taxTreatment": "unknown",
      "price": {
        "basis": "base-unit",
        "amount": "0.397",
        "currency": "EUR"
      }
    },
    {
      "offerId": "aliexpress-bulk-capacitor-1000uf",
      "availability": "unknown",
      "observedAt": null,
      "taxTreatment": "unknown",
      "price": {
        "basis": "base-unit",
        "amount": "0.1645",
        "currency": "EUR"
      }
    },
    {
      "offerId": "aliexpress-cable-gland-assortment",
      "availability": "unknown",
      "observedAt": null,
      "taxTreatment": "unknown",
      "price": {
        "basis": "base-unit",
        "amount": "11.19",
        "currency": "EUR"
      }
    },
    {
      "offerId": "aliexpress-capsule-slip-ring-6x2a",
      "availability": "unknown",
      "observedAt": null,
      "taxTreatment": "unknown",
      "price": {
        "basis": "base-unit",
        "amount": "9.69",
        "currency": "EUR"
      }
    },
    {
      "offerId": "aliexpress-controller-buck-converter-48v-5v",
      "availability": "unknown",
      "observedAt": null,
      "taxTreatment": "unknown",
      "price": {
        "basis": "base-unit",
        "amount": "5.55",
        "currency": "EUR"
      }
    },
    {
      "offerId": "aliexpress-emergency-stop-switch",
      "availability": "unknown",
      "observedAt": null,
      "taxTreatment": "unknown",
      "price": {
        "basis": "base-unit",
        "amount": "11.95",
        "currency": "EUR"
      }
    },
    {
      "offerId": "aliexpress-extension-spring-assortment",
      "availability": "unknown",
      "observedAt": null,
      "taxTreatment": "unknown",
      "price": {
        "basis": "base-unit",
        "amount": "12.63",
        "currency": "EUR"
      }
    },
    {
      "offerId": "aliexpress-flexible-jaw-coupling-8mm",
      "availability": "unknown",
      "observedAt": null,
      "taxTreatment": "unknown",
      "price": {
        "basis": "base-unit",
        "amount": "3.05",
        "currency": "EUR"
      }
    },
    {
      "offerId": "aliexpress-heat-set-insert-assortment",
      "availability": "unknown",
      "observedAt": null,
      "taxTreatment": "unknown",
      "price": {
        "basis": "base-unit",
        "amount": "16",
        "currency": "EUR"
      }
    },
    {
      "offerId": "aliexpress-micro-pan-tilt-servo",
      "availability": "unknown",
      "observedAt": null,
      "taxTreatment": "unknown",
      "price": {
        "basis": "purchase-unit",
        "amount": "16.72",
        "currency": "EUR",
        "normalizationNote": "Recorded per-servo value was a repeating decimal for a three-servo pack."
      }
    },
    {
      "offerId": "aliexpress-pod-buck-converter-48v-5v",
      "availability": "unknown",
      "observedAt": null,
      "taxTreatment": "unknown",
      "price": {
        "basis": "base-unit",
        "amount": "5.55",
        "currency": "EUR"
      }
    },
    {
      "offerId": "aliexpress-pod-power-wire-black-awg26",
      "availability": "unknown",
      "observedAt": null,
      "taxTreatment": "unknown",
      "price": {
        "basis": "base-unit",
        "amount": "0.2076",
        "currency": "EUR"
      }
    },
    {
      "offerId": "aliexpress-pod-power-wire-red-awg26",
      "availability": "unknown",
      "observedAt": null,
      "taxTreatment": "unknown",
      "price": {
        "basis": "base-unit",
        "amount": "0.2076",
        "currency": "EUR"
      }
    },
    {
      "offerId": "aliexpress-roller-lever-microswitch",
      "availability": "unknown",
      "observedAt": null,
      "taxTreatment": "unknown",
      "price": {
        "basis": "base-unit",
        "amount": "0.479",
        "currency": "EUR"
      }
    },
    {
      "offerId": "aliexpress-shaft-collar-8mm",
      "availability": "unknown",
      "observedAt": null,
      "taxTreatment": "unknown",
      "price": {
        "basis": "base-unit",
        "amount": "5.05",
        "currency": "EUR"
      }
    },
    {
      "offerId": "aliexpress-stainless-fastener-assortment",
      "availability": "unknown",
      "observedAt": null,
      "taxTreatment": "unknown",
      "price": {
        "basis": "base-unit",
        "amount": "16",
        "currency": "EUR"
      }
    },
    {
      "offerId": "aliexpress-winch-drum-shaft-8mm",
      "availability": "unknown",
      "observedAt": null,
      "taxTreatment": "unknown",
      "price": {
        "basis": "base-unit",
        "amount": "4.16",
        "currency": "EUR"
      }
    },
    {
      "offerId": "aliexpress-wind-sensor-rs485-transceiver",
      "availability": "unknown",
      "observedAt": null,
      "taxTreatment": "unknown",
      "price": null
    },
    {
      "offerId": "bauhaus-din-rail-ground-distribution-block",
      "availability": "unknown",
      "observedAt": null,
      "taxTreatment": "unknown",
      "price": {
        "basis": "base-unit",
        "amount": "5.95",
        "currency": "EUR"
      }
    },
    {
      "offerId": "bauhaus-guy-turnbuckle-m12",
      "availability": "unknown",
      "observedAt": null,
      "taxTreatment": "unknown",
      "price": {
        "basis": "base-unit",
        "amount": "7.29",
        "currency": "EUR"
      }
    },
    {
      "offerId": "bauhaus-guy-wire-3mm",
      "availability": "unknown",
      "observedAt": null,
      "taxTreatment": "unknown",
      "price": {
        "basis": "base-unit",
        "amount": "3.04",
        "currency": "EUR"
      }
    },
    {
      "offerId": "bauhaus-motor-power-branch-cable",
      "availability": "unknown",
      "observedAt": null,
      "taxTreatment": "unknown",
      "price": {
        "basis": "base-unit",
        "amount": "1.78",
        "currency": "EUR"
      }
    },
    {
      "offerId": "bauhaus-post-electronics-enclosure",
      "availability": "unknown",
      "observedAt": null,
      "taxTreatment": "unknown",
      "price": {
        "basis": "base-unit",
        "amount": "6.89",
        "currency": "EUR"
      }
    },
    {
      "offerId": "bauhaus-pulley-bracket-backing-plate",
      "availability": "unknown",
      "observedAt": null,
      "taxTreatment": "unknown",
      "price": {
        "basis": "base-unit",
        "amount": "3.55",
        "currency": "EUR"
      }
    },
    {
      "offerId": "bauhaus-pulley-bracket-locknut-m12",
      "availability": "unknown",
      "observedAt": null,
      "taxTreatment": "unknown",
      "price": {
        "basis": "base-unit",
        "amount": "0.18",
        "currency": "EUR"
      }
    },
    {
      "offerId": "bauhaus-pulley-bracket-shackle-m8",
      "availability": "unknown",
      "observedAt": null,
      "taxTreatment": "unknown",
      "price": {
        "basis": "base-unit",
        "amount": "3.57",
        "currency": "EUR"
      }
    },
    {
      "offerId": "bauhaus-pulley-bracket-through-bolt-m12x160",
      "availability": "unknown",
      "observedAt": null,
      "taxTreatment": "unknown",
      "price": {
        "basis": "base-unit",
        "amount": "0.83",
        "currency": "EUR"
      }
    },
    {
      "offerId": "bauhaus-pulley-bracket-washer-m12",
      "availability": "unknown",
      "observedAt": null,
      "taxTreatment": "unknown",
      "price": {
        "basis": "base-unit",
        "amount": "0.16",
        "currency": "EUR"
      }
    },
    {
      "offerId": "bauhaus-top-pulley-bracket",
      "availability": "unknown",
      "observedAt": null,
      "taxTreatment": "unknown",
      "price": {
        "basis": "base-unit",
        "amount": "4.15",
        "currency": "EUR"
      }
    },
    {
      "offerId": "bauhaus-underground-cable-sleeve",
      "availability": "unknown",
      "observedAt": null,
      "taxTreatment": "unknown",
      "price": {
        "basis": "base-unit",
        "amount": "1.3956",
        "currency": "EUR"
      }
    },
    {
      "offerId": "bauhaus-wire-rope-clamp-3mm",
      "availability": "unknown",
      "observedAt": null,
      "taxTreatment": "unknown",
      "price": {
        "basis": "base-unit",
        "amount": "2.24",
        "currency": "EUR"
      }
    },
    {
      "offerId": "bauhaus-wire-rope-thimble-3mm",
      "availability": "unknown",
      "observedAt": null,
      "taxTreatment": "unknown",
      "price": {
        "basis": "base-unit",
        "amount": "0.52",
        "currency": "EUR"
      }
    },
    {
      "offerId": "bauhaus-zinc-spray",
      "availability": "unknown",
      "observedAt": null,
      "taxTreatment": "unknown",
      "price": {
        "basis": "base-unit",
        "amount": "11.69",
        "currency": "EUR"
      }
    },
    {
      "offerId": "cotra-zagreb-corner-post-treated-timber",
      "availability": "unknown",
      "observedAt": null,
      "taxTreatment": "unknown",
      "price": null
    },
    {
      "offerId": "dive-store-dyneema-positioning-line",
      "availability": "unknown",
      "observedAt": "2026-10-08T06:27:08.177Z",
      "taxTreatment": "unknown",
      "price": {
        "basis": "purchase-unit",
        "amount": "18.38",
        "currency": "EUR",